{
  "schemaVersion": 1,
  "project": "workworld",
  "updatedAt": "2026-10-22T01:44:55.464Z",
  "codeRevision": {
    "branch": "codex/hosted-enterprise-readiness",
    "commit": null,
    "note": "Hosted infrastructure provisioned and live synthetic SQL identity checks pass. Activation, real Auth browser acceptance, and enterprise integrations remain gated; see docs/ENTERPRISE_READINESS.md."
  },
  "milestones": [
    {
      "id": "M0",
      "title": "Discovery and bootstrap",
      "status": "passed",
      "prerequisites": [],
      "attempts": [
        {
          "timestamp": "2026-10-01T21:00:00.000Z",
          "commands": [
            {
              "cmd": "npm install",
              "exitCode": 0
            },
            {
              "cmd": "tsc --noEmit",
              "exitCode": 0
            },
            {
              "cmd": "curl -s -o /dev/null -w '%{http_code}' http://localhost:3100/",
              "exitCode": 0,
              "observed": "200"
            },
            {
              "cmd": "curl -s http://localhost:3100/health",
              "exitCode": 0,
              "observed": "{\"status\":\"ok\",\"service\":\"workworld\",\"mode\":\"demo\"}"
            }
          ],
          "evidencePaths": [
            "evidence/m0/environment.txt",
            "evidence/m0/route-probe.txt"
          ],
          "observation": "machine: repo created at /home/scott/repos/workworld on branch main; lockfile present (8476 lines); / and /health respond; gh authenticated as Hardonian; Hardonian/WorkWorld unused; codex CLI unauthenticated."
        }
      ],
      "manualJudgment": "Bootstrap verified against real commands. Working-title name recorded with no trademark claim; provisional alternative OpsDojo.",
      "blockers": [],
      "nextAction": "M1: episode specifications, grader contract, split policy, related-work table."
    },
    {
      "id": "M1",
      "title": "Task specification and related work",
      "status": "passed",
      "prerequisites": [
        "M0"
      ],
      "attempts": [
        {
          "timestamp": "2026-10-01T22:30:00.000Z",
          "commands": [
            {
              "cmd": "web_search x7 (GDPval, TheAgentCompany, WorkArena, tau2, Mechanize, Forage, Workera, 2026 enterprise benchmarks)",
              "exitCode": 0,
              "observed": "primary + secondary sources retrieved and dated; see docs/RELATED_WORK.md"
            },
            {
              "cmd": "write docs/EPISODE_SPECS.md docs/GRADER_CONTRACT.md docs/RELATED_WORK.md materials/*",
              "exitCode": 0
            }
          ],
          "evidencePaths": [
            "docs/EPISODE_SPECS.md",
            "docs/GRADER_CONTRACT.md",
            "docs/RELATED_WORK.md",
            "materials/practitioner-review-packet.md",
            "materials/participant-info-consent-draft.md",
            "materials/human-feasibility-protocol.md",
            "materials/assessor-guide.md"
          ],
          "observation": "machine: 6 episode specs (A1,A2,B1,B2,C1,C2) with policies P1-P12, typed action set, scheduled events, terminal conditions, T1 outcome checks, T3 rubric; 6 withheld variants W1-W6 designed; related-work table compiled from dated sources; study materials drafted with pending labels."
        }
      ],
      "manualJudgment": "Gate met: implementable specs, grader contract, split policy, dated related-work table, explicit unvalidated assumptions (EPISODE_SPECS §8), withheld variants are policy/causal (not renames). External practitioner review remains pending and is labeled as such. No novelty claim made.",
      "blockers": [],
      "nextAction": "M2: implement domain core + scenario definitions + baseline + negative controls."
    },
    {
      "id": "M2",
      "title": "State engine, persistence and adversarial grading",
      "status": "passed",
      "prerequisites": [
        "M1"
      ],
      "attempts": [
        {
          "timestamp": "2026-10-01T23:30:00.000Z",
          "commands": [
            {
              "cmd": "tsc --noEmit",
              "exitCode": 0
            },
            {
              "cmd": "npx vitest run",
              "exitCode": 0,
              "observed": "41 passed (4 files)"
            },
            {
              "cmd": "npm run baseline -- --json evidence/m2/baseline.json",
              "exitCode": 0,
              "observed": "6/6 episodes pass T1 (A1 9/9, A2 9/9, B1 9/9, B2 10/10, C1 9/9, C2 9/9)"
            },
            {
              "cmd": "npm run negatives -- --json evidence/m2/negatives.json",
              "exitCode": 0,
              "observed": "6/6 controls fail exactly their expected check (N1 requirements_met, N2 required_updates_done, N3 no_duplicate_settlement, N4 authorization_correct, N5 feasible_commitments, N6 help_policy)"
            }
          ],
          "evidencePaths": [
            "evidence/m2/test-log.txt",
            "evidence/m2/baseline.json",
            "evidence/m2/negatives.json",
            "evidence/m2/typecheck.txt"
          ],
          "observation": "machine: typed domain core (types/reducer/ledger/artifacts/engine/observation), event-sourced with logical-time scheduler, idempotency + revision protection, safe spreadsheet grammar + CSV injection defense; 6 scenario definitions validated by zod at load; FileStore/MemoryStore with digest-verified state and CorruptStateError recovery path; checkpoint/restore + replay digests verified in tests."
        }
      ],
      "manualJudgment": "Gate met with real execution evidence. Bugs found and fixed by the suite during the build: AP credit-balance sign error, cell-ref off-by-one, disjunctive predicate over-counting, boundary off-by-one on event-minute actions. Baseline/negative runs are labeled fixtures. feasible_commitments is a documented lower-bound heuristic (lead-time feasibility), not a full planning proof.",
      "blockers": [],
      "nextAction": "M3: build the human workspace UI over the shared domain core."
    },
    {
      "id": "M3",
      "title": "Complete human workspace",
      "status": "passed",
      "prerequisites": [
        "M2"
      ],
      "attempts": [
        {
          "timestamp": "2026-10-02T02:15:00.000Z",
          "commands": [
            {
              "cmd": "tsc --noEmit",
              "exitCode": 0
            },
            {
              "cmd": "npx vitest run",
              "exitCode": 0,
              "observed": "41 passed"
            },
            {
              "cmd": "npx playwright test",
              "exitCode": 0,
              "observed": "8 passed — all 6 episodes completed through the UI + refresh/resume + rejection-preservation"
            },
            {
              "cmd": "npm run build",
              "exitCode": 0,
              "observed": "production build clean (/, /workspace, /health, /api/*)"
            },
            {
              "cmd": "npx tsx scripts/capture-screenshots.ts",
              "exitCode": 0,
              "observed": "6 real screenshots in evidence/m3/screenshots"
            }
          ],
          "evidencePaths": [
            "evidence/m3/e2e-log.txt",
            "evidence/m3/screenshots/"
          ],
          "observation": "machine: workspace UI (scenario picker, brief, inbox, suppliers, orders, deliveries, invoices, ledger, tickets, sheets, notes) drives the shared domain core via /api/actions; server-side per-session state (httpOnly opaque cookie + FileStore) preserves work across refresh; action rejections return actionable errors and preserve work; outcome evidence panel shows deterministic checks."
        }
      ],
      "manualJudgment": "Gate met: every episode completable through the UI (e2e-verified), scheduled changes affect the workspace, actions invoke the shared core, refresh/resume works, artifacts and outcomes match actual state. Accessibility basics covered (labels, focus-visible, aria-live feedback, keyboard-reachable controls); fuller audit scheduled in M7.",
      "blockers": [],
      "nextAction": "M4: provider-neutral agent loop + adapters + assisted mode."
    },
    {
      "id": "M4",
      "title": "Agent and assisted modes",
      "status": "passed",
      "prerequisites": [
        "M2"
      ],
      "attempts": [
        {
          "timestamp": "2026-10-02T02:45:00.000Z",
          "commands": [
            {
              "cmd": "tsc --noEmit",
              "exitCode": 0
            },
            {
              "cmd": "npx vitest run",
              "exitCode": 0,
              "observed": "54 passed (5 files) incl. 13 agent-protocol tests"
            },
            {
              "cmd": "npm run build",
              "exitCode": 0
            },
            {
              "cmd": "npx tsx scripts/smoke-ollama.ts A1 (llama3.1:8b)",
              "exitCode": 0,
              "observed": "terminalReason=timeout after 60s call bound; timeout handled cleanly (evidence/m4/ollama-smoke-A1.json)"
            },
            {
              "cmd": "OLLAMA_MODEL=gemma3:4b npx tsx scripts/smoke-ollama.ts A1",
              "exitCode": 0,
              "observed": "live call completed; model returned advice-only decision (terminalReason=no_action); usage recorded; NOT a benchmark result"
            }
          ],
          "evidencePaths": [
            "evidence/m4/ollama-smoke-A1.json",
            "tests/agents.test.ts"
          ],